<?xml version="1.0"?>  <!-- edited with XML Spy v4.3 U (http://www.xmlspy.com) by Internal Use (Sirius Financial Solutions Plc) -->  <!-- pmnav_map_id = 54 -->  <!DOCTYPE MAP SYSTEM "navigatorxmv2.dtd">  <MAP WMTaskCode="UNDERNB" WMTaskDescription="Complete Underwriting New Business" ImageURL="http://www.siriusgroup.co.uk" TransactionType="NB" ProcessMode="2" AutoClose="False" NavigatorDriven="True" Title="NavigatorXM" RoadmapName="Underwriting New Business" Core="1" ElementID="E1" Version="200">   <STEP Description="Underwriting Find Party" Component="iPMBFindPartyWrapper.NavigatorV3" Type="FF" CancelAction="AP" OKAction="F1" OKSteps="0" CancelSteps="0" ComponentAction="1" ServerSide="False" CreateWMTask="False" ResumeStep="" Core="1" Submap="" OKNewRoadmap="" CancelNewRoadmap="" ElementID="E2"/>   <STEP Description="List Policies" Component="iPMUListPolicy.NavigatorV3" Type="FF" CancelAction="AP" OKAction="F1" OKSteps="0" CancelSteps="0" ComponentAction="2" ServerSide="False" CreateWMTask="False" ResumeStep="" Core="1" Submap="" OKNewRoadmap="" CancelNewRoadmap="" ElementID="E3">    <KEY Name="insurance_file_type" Value="4" ElementID="E4"/>   </STEP>   <STEP Description="Find Product Type" Component="iPMUFindProductType.NavigatorV3" Type="DF" CancelAction="AP" OKAction="F1" OKSteps="0" CancelSteps="0" ComponentAction="1" ServerSide="False" CreateWMTask="False" ResumeStep="" Core="1" Submap="" OKNewRoadmap="" CancelNewRoadmap="" ElementID="E7"/>   <STEP Description="Underwriting Policy" Component="iPMUPolicy.NavigatorV3" Type="DF" CancelAction="AP" OKAction="F1" OKSteps="0" CancelSteps="0" ComponentAction="1" ServerSide="False" CreateWMTask="False" ResumeStep="" Core="1" Submap="" OKNewRoadmap="" CancelNewRoadmap="" ElementID="E10"/>   <STEP Description="Underwriting Coinsurance" Component="iPMUCoinsurance.NavigatorV3" Type="DF" CancelAction="AP" OKAction="F1" OKSteps="0" CancelSteps="0" ComponentAction="1" ServerSide="False" CreateWMTask="False" ResumeStep="" Core="1" Submap="" OKNewRoadmap="" CancelNewRoadmap="" ElementID="E11"/>   <STEP Description="List Risks" Component="iPMUListRisks.NavigatorV3" Type="DF" CancelAction="AP" OKAction="F1" OKSteps="0" CancelSteps="0" ComponentAction="2" ServerSide="False" CreateWMTask="False" ResumeStep="" Core="1" Submap="" OKNewRoadmap="" CancelNewRoadmap="" Action1Action="BX" Action1Steps="2" Action2Action="QS" Action2Steps="0" ElementID="E12">    <KEY Name="TaskGroupCode" Value="New Business" ElementID="E43"/>    <KEY Name="claim_mode" Value="2" ElementID="E37"/>   </STEP>   <STEP Description="Statistics" Component="iPMUStats.NavigatorV3" Type="DF" CancelAction="AP" OKAction="F1" OKSteps="0" CancelSteps="0" ComponentAction="1" ServerSide="False" CreateWMTask="False" ResumeStep="" Core="1" Submap="" OKNewRoadmap="" CancelNewRoadmap="" ElementID="E38"/>   <STEP Description="Plan Maintenance" Component="iPMBFinancePlanMaint.NavigatorV3" Type="DF" CancelAction="F1" OKAction="F1" OKSteps="0" CancelSteps="0" ComponentAction="1" ServerSide="False" CreateWMTask="False" ResumeStep="" Core="1" Submap="" OKNewRoadmap="" CancelNewRoadmap="" ElementID="E44">    <KEY Name="TaskGroupCode" Value="New Business" ElementID="E45"/>   </STEP>   <STEP Description="Accumulation Values" Component="iPMUAccumulationValues.NavigatorV3" Type="DF" CancelAction="AP" OKAction="F1" OKSteps="0" CancelSteps="0" ComponentAction="1" ServerSide="False" CreateWMTask="False" ResumeStep="" Core="1" Submap="" OKNewRoadmap="" CancelNewRoadmap="" ElementID="E46"/>   <STEP Description="Produce Schedule" Component="iPMUGetDocument.NavigatorV3" Type="DF" CancelAction="AP" OKAction="F1" OKSteps="0" CancelSteps="0" ComponentAction="1" ServerSide="False" CreateWMTask="False" ResumeStep="" Core="1" Submap="" OKNewRoadmap="" CancelNewRoadmap="" ElementID="E47" ResourceId="100">    <KEY Name="document_id" Value="4" ElementID="E48"/>    <KEY Name="short_code" Value="schedule" ElementID="E49"/>   </STEP>   <STEP Description="Produce Certificate" Component="iPMUGetDocument.NavigatorV3" Type="DF" CancelAction="AP" OKAction="F1" OKSteps="0" CancelSteps="0" ComponentAction="1" ServerSide="False" CreateWMTask="False" ResumeStep="" Core="1" Submap="" OKNewRoadmap="" CancelNewRoadmap="" ElementID="E50">    <KEY Name="document_id" Value="5" ElementID="E51"/>    <KEY Name="short_code" Value="certificate" ElementID="E52"/>   </STEP>   <STEP Description="Produce Debit Note" Component="iPMUGetDocument.NavigatorV3" Type="DF" CancelAction="AP" OKAction="CP" OKSteps="0" CancelSteps="0" ComponentAction="1" ServerSide="False" CreateWMTask="False" ResumeStep="" Core="1" Submap="" OKNewRoadmap="" CancelNewRoadmap="" ElementID="E53" ResourceId="101">    <KEY Name="document_id" Value="3" ElementID="E54"/>    <KEY Name="short_code" Value="debitnote" ElementID="E55"/>   </STEP>  </MAP>  
