<?xml version="1.0"?>  <!-- edited with XML Spy v4.4 U (http://www.xmlspy.com) by Internal Use (Sirius Financial Solutions Plc) -->  <!-- pmnav_map_id = 58 -->  <!DOCTYPE MAP SYSTEM "navigatorxmv2.dtd">  <MAP WMTaskCode="UnderMTA" WMTaskDescription="Complete Underwriting MTA" ImageURL="http://www.siriusgroup.co.uk" TransactionType="MTA" ProcessMode="32" AutoClose="False" NavigatorDriven="True" Title="NavigatorXM" RoadmapName="Underwriting MTA" Core="1" ElementID="E1" Version="200">   <STEP Description="Underwriting Find Party" Component="iPMBFindPartyWrapper.NavigatorV3" Type="FF" CancelAction="AP" OKAction="F1" OKSteps="0" CancelSteps="0" ComponentAction="1" ServerSide="False" CreateWMTask="False" ResumeStep="" Core="1" Submap="" OKNewRoadmap="" CancelNewRoadmap="" ElementID="E2"/>   <STEP Description="List Policies" Component="iPMUListPolicy.NavigatorV3" Type="FF" CancelAction="AP" OKAction="F1" OKSteps="0" CancelSteps="0" ComponentAction="1" ServerSide="False" CreateWMTask="True" ResumeStep="" Core="1" Submap="" OKNewRoadmap="" CancelNewRoadmap="" ElementID="E3">    <KEY Name="insurance_file_type" Value="5" ElementID="E4"/>   </STEP>   <STEP Description="List Policy Version" Component="iPMUListPolicyVersion.NavigatorV3" Type="DF" CancelAction="AP" OKAction="F1" OKSteps="0" CancelSteps="0" ComponentAction="2" ServerSide="False" CreateWMTask="False" ResumeStep="" Core="1" Submap="" OKNewRoadmap="" CancelNewRoadmap="" ElementID="E5"/>   <STEP Description="Underwriting Policy" Component="iPMUPolicy.NavigatorV3" Type="DF" CancelAction="AP" OKAction="F1" OKSteps="0" CancelSteps="0" ComponentAction="1" ServerSide="False" CreateWMTask="False" ResumeStep="" Core="1" Submap="" OKNewRoadmap="" CancelNewRoadmap="" ElementID="E8"/>   <STEP Description="Underwriting Coinsurance" Component="iPMUCoinsurance.NavigatorV3" Type="DF" CancelAction="AP" OKAction="F1" OKSteps="0" CancelSteps="0" ComponentAction="1" ServerSide="False" CreateWMTask="False" ResumeStep="" Core="1" Submap="" OKNewRoadmap="" CancelNewRoadmap="" ElementID="E9"/>   <STEP Description="List Risks" Component="iPMUListRisks.NavigatorV3" Type="DF" CancelAction="AP" OKAction="F1" OKSteps="0" CancelSteps="0" ComponentAction="2" ServerSide="False" CreateWMTask="False" ResumeStep="" Core="1" Submap="" OKNewRoadmap="" CancelNewRoadmap="" ElementID="E10" Action1Action="BX" Action1Steps="2">    <KEY Name="claim_mode" Value="2" ElementID="E35"/>    <KEY Name="TaskGroupCode" Value="MTA" ElementID="E60"/>   </STEP>   <STEP Description="Statistics" Component="iPMUStats.NavigatorV3" Type="DF" CancelAction="AP" OKAction="F1" OKSteps="0" CancelSteps="0" ComponentAction="1" ServerSide="False" CreateWMTask="False" ResumeStep="" Core="1" Submap="" OKNewRoadmap="" CancelNewRoadmap="" ElementID="E36"/>   <STEP Description="Plan Maintenance" Component="iPMBFinancePlanMaint.NavigatorV3" Type="DF" CancelAction="F1" OKAction="F1" OKSteps="0" CancelSteps="0" ComponentAction="1" ServerSide="False" CreateWMTask="False" ResumeStep="" Core="1" Submap="" OKNewRoadmap="" CancelNewRoadmap="" ElementID="E42">    <KEY Name="TaskGroupCode" Value="MTA" ElementID="E43"/>   </STEP>   <STEP Description="Accumulation Values" Component="iPMUAccumulationValues.NavigatorV3" Type="DF" CancelAction="AP" OKAction="F1" OKSteps="0" CancelSteps="0" ComponentAction="1" ServerSide="False" CreateWMTask="False" ResumeStep="" Core="1" Submap="" OKNewRoadmap="" CancelNewRoadmap="" ElementID="E44"/>   <STEP Description="Produce Schedule" Component="iPMUGetDocument.NavigatorV3" Type="DF" CancelAction="AP" OKAction="F1" OKSteps="0" CancelSteps="0" ComponentAction="1" ServerSide="False" CreateWMTask="False" ResumeStep="" Core="1" Submap="" OKNewRoadmap="" CancelNewRoadmap="" ElementID="E45" ResourceId="102">    <KEY Name="document_id" Value="4" ElementID="E46"/>    <KEY Name="short_code" Value="schedule" ElementID="E47"/>   </STEP>   <STEP Description="Produce Certificate" Component="iPMUGetDocument.NavigatorV3" Type="DF" CancelAction="AP" OKAction="F1" OKSteps="0" CancelSteps="0" ComponentAction="1" ServerSide="False" CreateWMTask="False" ResumeStep="" Core="1" Submap="" OKNewRoadmap="" CancelNewRoadmap="" ElementID="E48">    <KEY Name="document_id" Value="5" ElementID="E49"/>    <KEY Name="short_code" Value="certificate" ElementID="E50"/>   </STEP>   <STEP Description="Produce Debit Note" Component="iPMUGetDocument.NavigatorV3" Type="DF" CancelAction="AP" OKAction="CP" OKSteps="0" CancelSteps="0" ComponentAction="1" ServerSide="False" CreateWMTask="False" ResumeStep="" Core="1" Submap="" OKNewRoadmap="" CancelNewRoadmap="" ElementID="E51" ResourceId="101">    <KEY Name="document_id" Value="3" ElementID="E52"/>    <KEY Name="short_code" Value="debitnote" ElementID="E53"/>   </STEP>  </MAP>  
