<!-- <?xml version="1.0"?-->
<!-- edited with XML Spy v4.4 U (http://www.xmlspy.com) by Steve Thomas (Sirius Financial Systems) -->
<!-- pmnav_map_id = ?? -->
<!DOCTYPE MAP SYSTEM "navigatorxmV2.dtd">
<MAP WMTaskCode="WMPMBMTA" WMTaskDescription="Generic MTA" ImageURL="http://www.siriusgroup.co.uk" TransactionType="G_MTA" ProcessMode="32" AutoClose="False" NavigatorDriven="True" Title="NavigatorXM" RoadmapName="Generic MTA" Core="1" ElementID="E1" Version="200">
	<STEP Description="Find Party" Component="iPMBFindParty.Interface_Renamed" Type="FF" CancelAction="AP" OKAction="F1" OKSteps="0" CancelSteps="0" ComponentAction="0" ServerSide="False" CreateWMTask="False" Core="1" ResumeStep="-1" Submap="" OKNewRoadmap="" CancelNewRoadmap="" ElementID="E2">
	</STEP>
	<STEP Description="Find Policy" Component="iCNListPolicyWrapper.NavigatorV3" Type="FF" CancelAction="AP" OKAction="F1" OKSteps="0" CancelSteps="0" ComponentAction="2" ServerSide="False" CreateWMTask="False" Core="1" ResumeStep="-1" Submap="" OKNewRoadmap="" CancelNewRoadmap="" ElementID="E3">
		<KEY Name="insurance_file_type" Value="POLICY" ElementID="E4"/>
	</STEP>
	<STEP Description="Find Policy Version" Component="iPMUListPolicyVersion.Interface_Renamed" Type="FF" CancelAction="AP" OKAction="F1" OKSteps="0" CancelSteps="0" ComponentAction="2" ServerSide="False" CreateWMTask="False" Core="1" ResumeStep="-1" Submap="" OKNewRoadmap="" CancelNewRoadmap="" ElementID="E5">
	</STEP>
	<STEP Description="Retrieve Quote Control" Component="iPMBMTATypeControl.Interface_Renamed" Type="DF" CancelAction="FX" OKAction="F1" OKSteps="0" CancelSteps="3" ComponentAction="2" ServerSide="False" CreateWMTask="False" Core="1" ResumeStep="-1" Submap="" OKNewRoadmap="" CancelNewRoadmap="" ElementID="E6">
	</STEP>
	<STEP Description="Choose MTA Type" Component="iPMBMTAChoice.Interface_Renamed" Type="DF" CancelAction="BX" OKAction="F1" OKSteps="0" CancelSteps="2" ComponentAction="2" ServerSide="False" CreateWMTask="False" Core="1" ResumeStep="-1" Submap="" OKNewRoadmap="" CancelNewRoadmap="" ElementID="E7">
	</STEP>
	<STEP Description="Edit Risk Data" Component="iPMURisk.Interface_Renamed" Type="DF" CancelAction="AP" OKAction="F1" OKSteps="0" CancelSteps="0" ComponentAction="2" ServerSide="False" CreateWMTask="False" Core="1" ResumeStep="-1" Submap="" OKNewRoadmap="" CancelNewRoadmap="" ElementID="E8">
	</STEP>
	<STEP Description="Quote Display" Component="iPMBQuoteDisplay.Interface_Renamed" Type="DF" CancelAction="B1" OKAction="F1" OKSteps="0" CancelSteps="0" ComponentAction="0" ServerSide="False" CreateWMTask="True" Core="1" ResumeStep="-1" Submap="" OKNewRoadmap="" CancelNewRoadmap="" ElementID="E9">
		<KEY Name="process_type" Value="MTA_Q" ElementID="E10"/>
		<KEY Name="wm_task" Value="WMPMBMTA" ElementID="E44"/>
	</STEP>
	<STEP Description="Update Quote Policy" Component="bSIRQuotePolicy.NavigatorV3" Type="BO" CancelAction="AP" OKAction="F1" OKSteps="1" CancelSteps="0" ComponentAction="2" ServerSide="True" CreateWMTask="True" Core="1" ResumeStep="-1" Submap="" OKNewRoadmap="" CancelNewRoadmap="" ElementID="E11">
		<KEY Name="return_status" Value="20" ElementID="E12"/>
	</STEP>
	<!-- optionally display the edit policy screen... -->
	<STEP Description="Edit Policy" Component="iPMBPolicy.Interface_Renamed" Type="DF" CancelAction="AP" OKAction="F1" OKSteps="1" CancelSteps="0" ComponentAction="2" ServerSide="False" CreateWMTask="True" Core="1" ResumeStep="-1" Submap="" OKNewRoadmap="" CancelNewRoadmap="" CheckSystemOption="202" SystemOptionValue="1" ElementID="E24">
		<KEY Name="branch_selection_not_required" Value="1" ElementID="E25"/>
	</STEP>
	<!-- ...or show payment method screen -->
	<STEP Description="Payment Method" Component="iPMBPaymentScreen.NavigatorV3" Type="DF" CancelAction="AP" OKAction="F1" OKSteps="1" CancelSteps="0" ComponentAction="2" ServerSide="False" CreateWMTask="True" Core="1" ResumeStep="-1" Submap="" OKNewRoadmap="" CancelNewRoadmap="" CheckSystemOption="202" SystemOptionValue="0" ElementID="E26"/>
	<!-- raise a debit only if the system option allows -->
	<!-- ...using the schemes component -->
	<STEP Description="Raise Debit" Component="iCNCTransactionsWrapper.NavigatorV3" Type="BO" CancelAction="AP" OKAction="F1" OKSteps="1" CancelSteps="0" ComponentAction="2" ServerSide="False" CreateWMTask="True" Core="1" ResumeStep="-1" Submap="" OKNewRoadmap="" CancelNewRoadmap="" CheckSystemOption="201" SystemOptionValue="1" ElementID="E27"/>
	<!-- ... or using the standard back-office component -->
	<STEP Description="Raise Debit" Component="iPMBTransactionsWrapper.NavigatorV3" Type="DF" CancelAction="F1" OKAction="F1" OKSteps="1" CancelSteps="0" ComponentAction="2" ServerSide="False" CreateWMTask="True" Core="1" ResumeStep="-1" Submap="" OKNewRoadmap="" CancelNewRoadmap="" CheckSystemOption="201" SystemOptionValue="2" ElementID="E28"/>
	<STEP Description="Cash List" Component="iACTCashList.NavigatorV3" Type="DF" CancelAction="FX" OKAction="F1" OKSteps="0" CancelSteps="2" ComponentAction="1" ServerSide="False" CreateWMTask="True" Core="1" ResumeStep="-1" Submap="" OKNewRoadmap="" CancelNewRoadmap="" CheckSystemOption="124" SystemOptionValue="1" ShowWMTaskInterface="False" ElementID="E40">
		<KEY Name="cash_list_roadmap" Value="DECIDE" ElementID="E41"/>
	</STEP>
	<STEP Description="Cash List Item" Component="iACTCashListItem.Interface_Renamed" Type="DF" CancelAction="FX" OKAction="F1" OKSteps="0" CancelSteps="1" ComponentAction="2" ServerSide="False" CreateWMTask="True" Core="1" ResumeStep="-1" Submap="" OKNewRoadmap="" CancelNewRoadmap="" CheckSystemOption="124" SystemOptionValue="1" ShowWMTaskInterface="False" ElementID="E42">
		<KEY Name="allow_allocate_button" Value="-1" ElementID="E43"/>
	</STEP>
	<!-- select instalment plan only if the system option allows - NOT SUPPORTED AT THE MOMENT -->
	<STEP Description="Do you wish to print the documentation?" Component="iPMDecision.Interface_Renamed" Type="QF" CancelAction="AP" OKAction="F1" OKSteps="1" CancelSteps="0" ComponentAction="0" ServerSide="False" CreateWMTask="True" Core="1" ResumeStep="-1" Submap="" OKNewRoadmap="" CancelNewRoadmap="" ElementID="E17">
		<KEY Name="decision_title" Value="Letter" ElementID="E18"/>
		<KEY Name="decision_text" Value="Do you wish to produce a letter now?" ElementID="E19"/>
		<KEY Name="PMKeyNameRunMode" Value="ACMergeMode" ElementID="E20"/>
	</STEP>
	<STEP Description="Produce Letter" Component="iPMBDocProductionWrapper.NavigatorV3" Type="PO" CancelAction="AP" OKAction="F1" OKSteps="1" CancelSteps="0" ComponentAction="0" ServerSide="False" CreateWMTask="True" Core="1" ResumeStep="-1" Submap="" OKNewRoadmap="" CancelNewRoadmap="" ElementID="E21">
		<KEY Name="nav_step" Value="DOCUMENT" ElementID="E22"/>
		<KEY Name="process_type" Value="MTA" ElementID="E23"/>
	</STEP>
</MAP>

