<?xml version="1.0"?>
<!-- edited with XML Spy v4.4 U (http://www.xmlspy.com) by Steve Thomas (Sirius Financial Systems) -->
<!-- pmnav_map_id = ?? -->
<!DOCTYPE MAP SYSTEM "navigatorxmV2.dtd">
<MAP WMTaskCode="OPNCMPLT" WMTaskDescription="New Complaint" ImageURL="http://www.siriusgroup.co.uk" TransactionType="NB" ProcessMode="1" AutoClose="False" NavigatorDriven="True" Title="NavigatorXM" RoadmapName="New Complaint" Core="1" ElementID="E1" Version="200">
	<STEP Description="Policy or Claim Complaint?" Component="iPMDecision.Interface_Renamed" Type="QF" CancelAction="FX" OKAction="F1" OKSteps="0" CancelSteps="3" ComponentAction="0" ServerSide="False" CreateWMTask="False" Core="1" ResumeStep="-1" Submap="" OKNewRoadmap="" CancelNewRoadmap="" ElementID="E3">
		<KEY Name="decision_title" Value="Policy or Claim Complaint?" ElementID="E4"/>
		<KEY Name="decision_text" Value="Does this complaint relate to a Policy?" ElementID="E5"/> 
	</STEP>
	<STEP Description="Find Client" Component="iPMBFindParty.Interface_Renamed" Type="FF" CancelAction="AP" OKAction="F1" OKSteps="0" CancelSteps="0" ComponentAction="0" ServerSide="False" CreateWMTask="True" Core="1" ResumeStep="-1" Submap="" OKNewRoadmap="" CancelNewRoadmap="" ElementID="E2"/>
	<STEP Description="Find Policy" Component="iPMUListPolicy.NavigatorV3" Type="FF" CancelAction="AP" OKAction="FX" OKSteps="2" CancelSteps="0" ComponentAction="0" ServerSide="False" CreateWMTask="False" Core="1" ResumeStep="-1" Submap="" OKNewRoadmap="" CancelNewRoadmap="" ElementID="E7"/>
	<STEP Description="Find Claim" Component="iCLMFindClaim.NavigatorV3" Type="FF" CancelAction="AP" OKAction="F1" OKSteps="0" CancelSteps="0" ComponentAction="0" ServerSide="False" CreateWMTask="False" Core="1" ResumeStep="-1" Submap="" OKNewRoadmap="" CancelNewRoadmap="" ElementID="E6"/>
	<STEP Description="Add Complaint Details" Component="iPMBComplaint.NavigatorV3" Type="DF" CancelAction="AP" OKAction="F1" OKSteps="0" CancelSteps="0" ComponentAction="1" ServerSide="False" CreateWMTask="True" Core="1" ResumeStep="-1" Submap="" OKNewRoadmap="" CancelNewRoadmap="" ElementID="E8"/>
	<STEP Description="Print Letter?" Component="iPMDecision.Interface_Renamed" Type="QF" CancelAction="AP" OKAction="F1" OKSteps="0" CancelSteps="0" ComponentAction="1" ServerSide="False" CreateWMTask="True" Core="1" ResumeStep="-1" Submap="" OKNewRoadmap="" CancelNewRoadmap="" ElementID="E9">
		<KEY Name="decision_title" Value="Print Letter?" ElementID="E10"/>
		<KEY Name="decision_text" Value="Do you wish to print a letter?" ElementID="E11"/>
	</STEP>
	<STEP Description="Select Document" Component="iPMBFindDocTemplate.NavigatorV3" Type="FF" CancelAction="AP" OKAction="F1" OKSteps="0" CancelSteps="0" ComponentAction="0" ServerSide="False" CreateWMTask="True" Core="1" ResumeStep="-1" Submap="" OKNewRoadmap="" CancelNewRoadmap="" ElementID="E12"/>
	<STEP Description="Print Document" Component="iPMBDocTemplate.NavigatorV3" Type="FF" CancelAction="AP" OKAction="F1" OKSteps="0" CancelSteps="0" ComponentAction="0" ServerSide="False" CreateWMTask="True" Core="1" ResumeStep="-1" Submap="" OKNewRoadmap="" CancelNewRoadmap="" ElementID="E13" >
		<KEY Name="ArchiveAfterPrinting" Value="1" ElementID="E14" />
	</STEP>
</MAP>
