<?xml version="1.0" encoding="UTF-8"?>
<!-- pmnav_map_id = 41 -->
<!DOCTYPE MAP SYSTEM "navigatorxmv2.dtd">
<MAP WMTaskCode="MAINCLM" WMTaskDescription="Maintain Claim" ImageURL="http://www.siriusgroup.co.uk" TransactionType="G_NB" ProcessMode="4" AutoClose="False" NavigatorDriven="False" Title="NavigatorXM" RoadmapName="Maintain Claim" Core="1" Version="200" ElementID="E1">
	<STEP Description="Find Claim" Component="iCLMFindClaim.Interface_Renamed" Type="FF" CancelAction="BX" OKAction="FX" OKSteps="0" CancelSteps="0" ComponentAction="2" ServerSide="False" CreateWMTask="False" ResumeStep="" Core="1" Submap="" OKNewRoadmap="" CancelNewRoadmap="" ElementID="E2"/>
	<STEP Description="Claim Details" Component="iOpenClaim.Interface_Renamed" Type="DF" CancelAction="BX" OKAction="FX" OKSteps="0" CancelSteps="0" ComponentAction="2" ServerSide="False" CreateWMTask="False" ResumeStep="" Core="1" Submap="" OKNewRoadmap="" CancelNewRoadmap="" CheckSystemOption="2032" SystemOptionValue="1" ElementID="E3"/>
	<STEP Description="Edit Claim Text Files" Component="iPMBTextFiles.Interface_Renamed" Type="DF" CancelAction="BX" OKAction="FX" OKSteps="0" CancelSteps="0" ComponentAction="2" ServerSide="False" CreateWMTask="False" ResumeStep="" Core="1" Submap="" OKNewRoadmap="" CancelNewRoadmap="" CheckSystemOption="2033" SystemOptionValue="1" ElementID="E4"/>
	<STEP Description="Risk Details" Component="iCLMRiskDetails.Interface_Renamed" Type="DF" CancelAction="BX" OKAction="FX" OKSteps="0" CancelSteps="0" ComponentAction="2" ServerSide="False" CreateWMTask="False" ResumeStep="" Core="1" Submap="" OKNewRoadmap="" CancelNewRoadmap="" CheckSystemOption="2034" SystemOptionValue="1" ElementID="E5"/>
	<STEP Description="Information Checklist" Component="iCLMInfoChklst.Interface_Renamed" Type="DF" CancelAction="BX" OKAction="FX" OKSteps="0" CancelSteps="0" ComponentAction="2" ServerSide="False" CreateWMTask="False" ResumeStep="" Core="1" Submap="" OKNewRoadmap="" CancelNewRoadmap="" CheckSystemOption="2035" SystemOptionValue="1" ElementID="E6"/>
	<STEP Description="Third Party Recovery" Component="iCLMThirdPartyRecovery.Interface_Renamed" Type="DF" CancelAction="BX" OKAction="FX" OKSteps="0" CancelSteps="0" ComponentAction="2" ServerSide="False" CreateWMTask="False" ResumeStep="" Core="1" Submap="" OKNewRoadmap="" CancelNewRoadmap="" CheckSystemOption="2036" SystemOptionValue="1" ElementID="E7"/>
	<STEP Description="Salvage Recovery" Component="iCLMSalvageRecovery.Interface_Renamed" Type="DF" CancelAction="BX" OKAction="FX" OKSteps="0" CancelSteps="0" ComponentAction="2" ServerSide="False" CreateWMTask="False" ResumeStep="" Core="1" Submap="" OKNewRoadmap="" CancelNewRoadmap="" CheckSystemOption="2037" SystemOptionValue="1" ElementID="E10"/>
	<STEP Description="Claim Letter" Component="iCLMGetClaimLetter.Interface_Renamed" Type="DF" CancelAction="BX" OKAction="FX" OKSteps="0" CancelSteps="0" ComponentAction="2" ServerSide="False" CreateWMTask="False" ResumeStep="" Core="1" Submap="" OKNewRoadmap="" CancelNewRoadmap="" CheckSystemOption="2038" SystemOptionValue="1" ElementID="E8"/>
	<STEP Description="Claim Diary" Component="iCLMCreateClaimDiary.Interface_Renamed" Type="DF" CancelAction="BX" OKAction="FX" OKSteps="0" CancelSteps="0" ComponentAction="2" ServerSide="False" CreateWMTask="False" ResumeStep="" Core="1" Submap="" OKNewRoadmap="" CancelNewRoadmap="" CheckSystemOption="2039" SystemOptionValue="1" ElementID="E9"/>
</MAP>
