<?xml version="1.0"?>
<!DOCTYPE MAP SYSTEM "navigatorxmV2.dtd">
<MAP WMTaskCode="COMMPAY" WMTaskDescription="Commission Payments" ImageURL="http://www.siriusgroup.co.uk" TransactionType="NB" ProcessMode="0" AutoClose="True" NavigatorDriven="True" Title="NavigatorXM" RoadmapName="Commission Payments" Core="1" Version="27" ElementID="E1">
	<STEP Description="Find Agents" Component="iACTAgentSelect.NavigatorV3" Type="DF" CancelAction="AP" OKAction="F1" OKSteps="0" CancelSteps="0" ComponentAction="1" ServerSide="False" CreateWMTask="True" Core="1" ResumeStep="-1" Submap="" OKNewRoadmap="" CancelNewRoadmap="" ElementID="E2">
		<KEY Name="OverrideFind" Value="1" ElementID="E21"/>
		<KEY Name="FindType" Value="0" ElementID="E22"/>
		<KEY Name="CF;party_party_type_id;R;0" Value="AG" ElementID="E23"/>
		<KEY Name="DefaultFindScreen" Value="iPMBFindPartyWrapper.NavigatorV3" ElementID="E24"/>
		<KEY Name="special_party" Value="AG" ElementID="E25"/>
		<KEY Name="MultiSelection" Value="True" ElementID="E26"/>
		<KEY Name="PMWrkTaskCode" Value="COMMPAY" ElementID="E27"/>
	</STEP>
	<STEP Description="Agent Summary" Component="iACTCommissionPayments.NavigatorV3" Type="FF" CancelAction="AP" OKAction="CP" OKSteps="0" CancelSteps="0" ComponentAction="2" ServerSide="False" CreateWMTask="True" Core="1" ResumeStep="-1" Submap="" OKNewRoadmap="" CancelNewRoadmap="" ElementID="E4">
	</STEP>
</MAP>
