<?xml version="1.0"?>
<!-- edited with XML Spy v4.3 U (http://www.xmlspy.com) by Internal Use (Sirius Financial Solutions Plc) -->
<!-- pmnav_map_id = 59 -->
<!DOCTYPE MAP SYSTEM "navigatorxmv2.dtd">
<MAP WMTaskCode="" WMTaskDescription="Underwriting MTA (No Transactions)" ImageURL="http://www.siriusgroup.co.uk" TransactionType="MTA" ProcessMode="32" AutoClose="False" NavigatorDriven="True" Title="NavigatorXM" RoadmapName="Underwriting MTA (No Transactions)" Core="1" ElementID="E1" Version="200">
	<STEP Description="Underwriting Find Party" Component="iPMBFindPartyWrapper.NavigatorV3" Type="FF" CancelAction="AP" OKAction="F1" OKSteps="0" CancelSteps="0" ComponentAction="1" ServerSide="False" CreateWMTask="False" ResumeStep="" Core="1" Submap="" OKNewRoadmap="" CancelNewRoadmap="" ElementID="E2"/>
	<STEP Description="List Policies" Component="iPMUListPolicy.NavigatorV3" Type="FF" CancelAction="AP" OKAction="F1" OKSteps="0" CancelSteps="0" ComponentAction="1" ServerSide="False" CreateWMTask="True" ResumeStep="" Core="1" Submap="" OKNewRoadmap="" CancelNewRoadmap="" ElementID="E3">
		<KEY Name="insurance_file_type" Value="5" ElementID="E4"/>
	</STEP>
	<STEP Description="List Policy Version" Component="iPMUListPolicyVersion.NavigatorV3" Type="DF" CancelAction="AP" OKAction="F1" OKSteps="0" CancelSteps="0" ComponentAction="2" ServerSide="False" CreateWMTask="False" ResumeStep="" Core="1" Submap="" OKNewRoadmap="" CancelNewRoadmap="" ElementID="E5"/>
	<STEP Description="Underwriting Policy" Component="iPMUPolicy.NavigatorV3" Type="DF" CancelAction="AP" OKAction="F1" OKSteps="0" CancelSteps="0" ComponentAction="1" ServerSide="False" CreateWMTask="False" ResumeStep="" Core="1" Submap="" OKNewRoadmap="" CancelNewRoadmap="" ElementID="E6"/>
	<STEP Description="Underwriting Coinsurance" Component="iPMUCoinsurance.NavigatorV3" Type="DF" CancelAction="AP" OKAction="F1" OKSteps="0" CancelSteps="0" ComponentAction="1" ServerSide="False" CreateWMTask="False" ResumeStep="" Core="1" Submap="" OKNewRoadmap="" CancelNewRoadmap="" ElementID="E7"/>
	<STEP Description="List Risks" Component="iPMUListRisks.NavigatorV3" Type="DF" CancelAction="AP" OKAction="F1" OKSteps="0" CancelSteps="0" ComponentAction="2" ServerSide="False" CreateWMTask="False" ResumeStep="" Core="1" Submap="" OKNewRoadmap="" CancelNewRoadmap="" ElementID="E8" Action1Action="BX" Action1Steps="2">
		<KEY Name="claim_mode" Value="2" ElementID="E23"/>
		<KEY Name="RoadmapDisablesInstalments" Value="true" ElementID="E43"/>
		<KEY Name="no_transactions" Value="1" ElementID="E44"/>
	</STEP>
</MAP>

